{
  "name": "Workspace Example - When combining multiple workspace files",
  "version": "1.0.0",
  "workspace_spec": "1.0",
  "system_prompt": "Workspace Multiple Example Prompt",
  "groups": [
    {
      "name": "Test 1",
      "system_prompt": "Group prompt 1",
      "opts": {
        "remove_config_system_prompt": true
      },
      "vars": {
        "base_dir": "tests/stubs"
      },
      "data": ["test1-file"]
    },
    {
      "name": "Test 2",
      "system_prompt": "Group prompt 2",
      "opts": {
        "remove_config_system_prompt": true
      },
      "vars": {
        "base_dir": "tests/stubs"
      },
      "data": ["test2-file"]
    }
  ],
  "data": {
    "test1-file": {
      "type": "file",
      "path": "${base_dir}/stub.go",
      "description": "A test description"
    },
    "test2-file": {
      "type": "file",
      "path": "${base_dir}/stub.go",
      "description": "A test description"
    }
  }
}
